{
  "schema_version": 1,
  "id": "security-reviewer",
  "description": "Design-panel security review; read-only.",
  "agents": [
    "agents/panel/security-reviewer.md"
  ],
  "agent_types": [
    "security-reviewer"
  ],
  "tools": [
    "read",
    "search",
    "plan"
  ],
  "privileged_actions": [],
  "budget": {
    "max_spawns_per_phase": 0
  },
  "review": {
    "required": false
  },
  "escalation": {
    "to": "hypervisor",
    "when": [
      "blocking-finding"
    ]
  }
}
